{
	"$schema": "https://json-schema.org/draft/2020-12/schema",
	"id": "https://github.com/cyclosproject/ng-openapi-gen/blob/master/ng-openapi-gen-schema.json",
	"title": "Options for ng-openapi-gen",
	"type": "object",
	"required": ["input"],
	"properties": {
		"$schema": {
			"type": "string"
		},
		"input": {
			"description": "The input file or URL to the OpenAPI 3.0 / 3.1 specification, JSON or YAML, local file or URL",
			"type": "string"
		},
		"output": {
			"description": "Where generated files will be written to. Defaults to 'src/app/api'.",
			"type": "string",
			"default": "src/app/api"
		},
		"fetchTimeout": {
			"description": "Indicates the timeout when fetching the input URL, in milliseconds. Defaults to 20 seconds (20000).",
			"type": "number",
			"default": 20000
		},
		"removeStaleFiles": {
			"description": "Indicates whether or not to remove any files in the output folder that were not generated. Defaults to true.",
			"type": "boolean",
			"default": true
		},
		"useTempDir": {
			"description": "When specified, will create temporary files in system temporary folder instead of output folder",
			"default": false,
			"type": "boolean"
		},
		"silent": {
			"description": "When set to true, no verbose output will be displayed.",
			"default": "false",
			"type": "boolean"
		},
		"defaultTag": {
			"description": "Tag name assumed for operations without tags. Defaults to 'Api'.",
			"type": "string"
		},
		"includeTags": {
			"description": "When specified, filters the generated services, including only those corresponding to this list of tags.",
			"type": "array",
			"items": {
				"type": "string"
			}
		},
		"excludeTags": {
			"description": "When specified, filters the generated services, excluding any service corresponding to this list of tags.",
			"type": "array",
			"items": {
				"type": "string"
			}
		},
		"configuration": {
			"description": "Name for the configuration class to generate. Defaults to 'ApiConfiguration'.",
			"type": "string",
			"default": "ApiConfiguration"
		},
		"apiService": {
			"description": "Name for the service used to invoke functions. Defaults to 'Api'. Set to false to not generate it.",
			"default": "Api",
			"anyOf": [
				{
					"type": "string"
				},
				{
					"type": "boolean"
				}
			]
		},
		"excludeParameters": {
			"description": "When specified, ignores on generated services any parameters whose names are in this list.",
			"type": "array",
			"items": {
				"type": "string"
			}
		},
		"functionIndex": {
			"description": "Typescript file, without '.ts' extension that exports all functions. Set to false to skip. Defaults to `functions`.",
			"default": "functions",
			"anyOf": [
				{
					"type": "string"
				},
				{
					"type": "boolean"
				}
			]
		},
		"camelizeModelNames": {
			"description": "When true (default) models names will be camelized, besides having the first letter capitalized. Setting to false will prevent camelizing.",
			"type": "boolean",
			"default": true
		},
		"ignoreUnusedModels": {
			"description": "Indicates whether or not to ignore model files that are not referenced by any operation. Defaults to true.",
			"type": "boolean",
			"default": true
		},
		"modelIndex": {
			"description": "Typescript file, without '.ts' extension that exports all models. Set to false to skip. Defaults to `models`.",
			"default": "models",
			"anyOf": [
				{
					"type": "string"
				},
				{
					"type": "boolean"
				}
			]
		},
		"modelPrefix": {
			"description": "Prefix for generated model classes. Defaults to empty.",
			"type": "string",
			"default": ""
		},
		"modelSuffix": {
			"description": "Suffix for generated model classes. Defaults to empty.",
			"type": "string",
			"default": ""
		},
		"enumStyle": {
			"description": "Determines how root enum models will be generated. Possible values are:\n\n- `alias`: just generate an union type with all possible values. Has zero impact in generated code bundle;\n- `upper` for an enum with UPPER_CASE names;\n- `pascal` for enum PascalCase names;\n- `ignorecase` for enum names that ignore character casing; Defaults to 'alias'.",
			"default": "alias",
			"enum": ["alias", "upper", "pascal", "ignorecase"]
		},
		"enumArray": {
			"description": "Should an array be exported for each enum model, in a file sibling to the enum definition? Defaults to `true` when `enumStyle` is `alias` (the default).",
			"default": true,
			"type": "boolean"
		},
		"promises": {
			"description": "When set to true, generated methods will return Promises instead of Observables. Defaults to true.",
			"default": true,
			"type": "boolean"
		},
		"services": {
			"description": "When set to true, services will be generated. Services are injectable classes that work as a facade to functions, a bit prettier API at cost of increased bundle size. Defaults to false.",
			"default": false,
			"type": "boolean"
		},
		"serviceIndex": {
			"description": "Typescript file, without '.ts' extension that exports all services. Set to false to skip. Defaults to `services`. Ignored when services are not generated.",
			"default": "services",
			"anyOf": [
				{
					"type": "string"
				},
				{
					"type": "boolean"
				}
			]
		},
		"servicePrefix": {
			"description": "Prefix for generated service classes. Defaults to empty. Ignored when services are not generated.",
			"type": "string",
			"default": ""
		},
		"serviceSuffix": {
			"description": "Suffix for generated service classes. Defaults to `Service`. Ignored when services are not generated.",
			"type": "string",
			"default": "Service"
		},
		"baseService": {
			"description": "Name for the base service class to generate. Defaults to 'BaseService'.",
			"type": "string",
			"default": "BaseService"
		},
		"requestBuilder": {
			"description": "Name for the request builder class to generate. Defaults to 'RequestBuilder'.",
			"type": "string",
			"default": "RequestBuilder"
		},
		"response": {
			"description": "Name for the response class to generate. Defaults to 'StrictHttpResponse'.",
			"type": "string",
			"default": "StrictHttpResponse"
		},
		"module": {
			"description": "Class name of the NgModule that provides all services. By default, no module is generated, as Angular discourages them since standalone components were introduced.",
			"default": false,
			"anyOf": [
				{
					"type": "string"
				},
				{
					"type": "boolean"
				}
			]
		},
		"endOfLineStyle": {
			"description": "Determines how to normalize line endings. Possible values are: `crlf`: normalize line endings to CRLF (Windows, DOS) => \\r\\n. `lf` normalize line endings to LF (Unix, OS X) => \\n. `cr` normalize line endings to CR (Mac OS) => \\r. `auto` normalize line endings for the current operating system. Defaults to 'auto'.",
			"default": "auto",
			"enum": ["crlf", "lf", "cr", "auto"]
		},
		"templates": {
			"description": "Custom templates directory. Any `.handlebars` files here will be used instead of the corresponding default.",
			"type": "string"
		},
		"indexFile": {
			"description": "When set to true, a index.ts file will be generated that exports all generated files.",
			"default": false,
			"type": "boolean"
		},
		"skipJsonSuffix": {
			"description": "When specified, does not generate a $Json suffix.",
			"default": false,
			"type": "boolean"
		},
		"customizedResponseType": {
			"type": "object",
			"description": "Defines which paths to use which responseType, commonly used when build-in deduction can't fullfill your needs",
			"minProperties": 1,
			"patternProperties": {
				".*": {
					"required": ["toUse"],
					"type": "object",
					"properties": {
						"toUse": {
							"type": "string",
							"enum": ["arraybuffer", "blob", "json", "document"]
						}
					}
				}
			}
		},
		"keepFullResponseMediaType": {
			"description": "When true, the expected response type in the request method names are not abbreviated and all response variants are kept.\\nWhen array is given, `mediaType` is expected to be a RegExp string matching the response media type. The first match in the array\\nwill decide whether or how to shorten the media type. If no mediaType is given, it will always match.\\n'short':     application/x-spring-data-compact+json    ->    getEntities$Json\\n'tail':      application/x-spring-data-compact+json    ->    getEntities$XSpringDataCompactJson\\n'full':      application/x-spring-data-compact+json    ->    getEntities$ApplicationXSpringDataCompactJson",
			"default": "false",
			"anyOf": [
				{
					"type": "boolean"
				},
				{
					"type": "array",
					"items": {
						"type": "object",
						"required": ["use"],
						"properties": {
							"mediaType": {
								"type": "string"
							},
							"use": {
								"enum": ["full", "tail", "short"]
							}
						}
					}
				}
			]
		},
		"typeFormatMapping": {
			"description": "mapping type string format",
			"type": "object",
			"default": false,
			"minProperties": 1,
			"patternProperties": {
				".*": {
					"type": "string"
				}
			}
		},
		"generateDefaultFactories": {
			"description": "When true, generates a factory function (modelNameDefault()) that returns an object with default values for each model. Default is false.",
			"type": "boolean",
			"default": false
		},
		"nullValueDefaultFactories": {
			"description": "Controls default values for primitive types in factory functions.\n- true: all primitives use null (string -> null, number -> null, boolean -> null)\n- false (default): primitives use type-specific defaults (string -> '', number -> NaN, boolean -> false)",
			"type": "boolean",
			"default": false
		},
		"strictPropertyTypes": {
			"description": "When true, removes '?' (optional) and '| null' from property types in generated interfaces. Useful for signal-based forms. Default is false.",
			"type": "boolean",
			"default": false
		},
		"validation": {
			"description": "Configuration pour la génération des schémas de validation.",
			"type": "object",
			"properties": {
				"enabled": {
					"description": "Quand activé, génère des validations Angular Signal Form pour chaque modèle. Désactivé par défaut.",
					"type": "boolean",
					"default": false
				},
				"mode": {
					"description": "Mode de génération:\n- 'function': génère `export function applyXxxValidation<T>(p: SchemaPath<T>): void { ... }`\n- 'schema': génère `export const xxxSchema = schema<Xxx>((rootPath) => { ... })`\nPar défaut 'function'.",
					"type": "string",
					"enum": ["function", "schema"],
					"default": "function"
				},
				"outputDir": {
					"description": "Répertoire de sortie pour les fichiers de validation. Par défaut 'validation'.",
					"type": "string",
					"default": "validation"
				},
				"defaultImportPath": {
					"description": "Chemin d'import par défaut pour les validateurs sans importPath spécifique. Par défaut '@angular/forms/signals'.",
					"type": "string",
					"default": "@angular/forms/signals"
				},
				"mapping": {
					"description": "Dictionnaire de mapping des validateurs x-validators vers les fonctions Signal Form. Chaque entrée peut avoir son propre importPath. Supporte les placeholders : {{path}}, {{value}}, {{property}}, {{type}}, {{min}}, {{max}}, {{pattern}}.\n\nExemple de mapping:\n```json\n{\n  \"required\": { \"validator\": \"required\", \"template\": \"required({{path}})\" },\n  \"maxLength\": { \"validator\": \"maxLength\", \"template\": \"maxLength({{path}}, {{value}})\" },\n  \"phoneFr\": { \"validator\": \"phoneFr\", \"template\": \"phoneFr({{path}})\", \"importPath\": \"@common/validators\" },\n  \"email\": { \"validator\": \"advancedEmail\", \"template\": \"advancedEmail({{path}})\", \"importPath\": \"@common/validators\" }\n}\n```",
					"type": "object",
					"additionalProperties": {
						"type": "object",
						"required": ["validator", "template"],
						"properties": {
							"validator": {
								"type": "string",
								"description": "Le nom de la fonction de validation à importer"
							},
							"template": {
								"type": "string",
								"description": "Le template pour générer l'appel au validateur. Supporte les placeholders : {{path}}, {{value}}, {{property}}, {{type}}"
							},
							"importPath": {
								"type": "string",
								"description": "Le chemin d'import pour ce validateur. Si non spécifié, utilise defaultImportPath."
							}
						}
					}
				},
				"disabled": {
					"description": "Liste des clés de mapping à désactiver.",
					"type": "array",
					"items": {
						"type": "string"
					}
				},
				"generateForInputDTOOnly": {
					"description": "Quand activé, génère les validations uniquement pour les modèles finissant par 'InputDTO'. Désactivé par défaut.",
					"type": "boolean",
					"default": false
				},
				"functionPrefix": {
					"description": "Préfixe pour les fonctions de validation générées. Par défaut 'apply'.",
					"type": "string",
					"default": "apply"
				},
				"functionSuffix": {
					"description": "Suffixe pour les fonctions de validation générées (mode 'function'). Par défaut 'Validation'.",
					"type": "string",
					"default": "Validation"
				},
				"schemaSuffix": {
					"description": "Suffixe pour les constantes de schéma générées (mode 'schema'). Par défaut 'ProfileSchema'.",
					"type": "string",
					"default": "ProfileSchema"
				},
				"addSchemaSignalForm": {
					"description": "Quand activé, utilise l'extension x-validators du schéma OpenAPI (générée par C# ValidationSchemaFilter) au lieu des contraintes OpenAPI standard. Nécessite de configurer 'mapping' avec les validateurs correspondants. Désactivé par défaut.",
					"type": "boolean",
					"default": false
				},
				"xValidatorsKey": {
					"description": "Le nom de la clé pour l'extension validators dans le schéma OpenAPI. Par défaut 'x-validators'.",
					"type": "string",
					"default": "x-validators"
				},
				"generateSchemasHelper": {
					"description": "Quand activé, génère un objet helper Schemas (comme Default pour les factories) qui exporte tous les schémas de validation. Désactivé par défaut.",
					"type": "boolean",
					"default": false
				}
			}
		},
		"formatter": {
			"description": "Commande à exécuter après la génération pour formater les fichiers. Utiliser {{output}} comme placeholder pour le répertoire de sortie. Exemples: 'prettier --write {{output}}', 'eslint --fix {{output}}'.",
			"type": "string"
		}
	}
}
